scenario_id,pre_fix_status,post_fix_status,entity,source_table,primary_table,correlation_id,required_evidence_post_fix,evidence_gate,ai_invoked,judge_invoked,validation_classification,score,conclusion
banking-benchmark-010,completed,completed,BNK-2026-0010-A,eval.transfers,eval.transfers,EVAL-BANKING-110,"transfers; audit_history; exceptions; integration_messages",passed,yes,yes,pass,80.373,No regression
orders-benchmark-010,completed,completed,ORD-2026-0010-A,eval.sales_order_lines,eval.sales_order_lines,EVAL-ORDERS-110,"sales_order_lines; audit_history; exceptions; integration_messages",passed,yes,yes,pass,80.373,No regression
shipping-benchmark-005,completed,completed,SHP-2026-0005-A,eval.shipment_milestones,eval.integration_messages,EVAL-SHIPPING-105,"shipment_milestones; integration_messages; audit_history; exceptions",passed,yes,yes,pass,83.945,Generic evidence-scope defect corrected
payroll-benchmark-010,completed,completed,PAY-2026-0010-A,eval.payroll_items,eval.payroll_items,EVAL-PAYROLL-110,"payroll_items; audit_history; exceptions; integration_messages",passed,yes,yes,pass,80.373,No regression
orders-benchmark-007,invalid_configuration,invalid_configuration,ORD-2026-0007-A,eval.receipts,eval.receipts,EVAL-ORDERS-107,"receipts; audit_history; exceptions; integration_messages","blocked: reported Processing condition not confirmed; fixture status is Failed",no,no,ineligible,,Expected condition-proof rejection; fixture/question contradiction
clinic-benchmark-007,invalid_configuration,invalid_configuration,CLN-2026-0007-A,eval.payments,eval.payments,EVAL-CLINIC-107,"payments; audit_history; exceptions; integration_messages","blocked: reported Processing condition not confirmed; fixture status is Failed",no,no,ineligible,,Expected condition-proof rejection; fixture/question contradiction
